row_id,ref,hebrew_phrase,linear_translation,metsudah_context,koren_context,skill_primary,skill_secondary,current_status,issue_type,what_to_check,recommended_default_decision,yossi_decision,yossi_notes
bereishis_2_1_to_2_3_source_to_skill_map_row_002,Bereishis 2:1,וְכׇל צְבָאָם,and all their multitudes (all they contained),"The heavens and the earth were completed, and [so were] all their conglomerations.","Thus the heavens and the earth were finished, and all their host.",phrase_translation,translation_context,pending_yossi_extraction_accuracy_pass,long_parenthetical;phrase_boundary_check;source_only_recommended,Confirm the parenthetical belongs to this Hebrew phrase. Confirm Hebrew-English phrase alignment against the trusted source. Keep source-only unless a separate future question/protected-preview gate approves use.,verified,,
bereishis_2_1_to_2_3_source_to_skill_map_row_009,Bereishis 2:3,אֲשֶׁר בָּרָא אֱלֹהִים לַעֲשׂוֹת,"that Hashem created (and was supposed) to make (on the seventh day, namely, the person, and instead He made double on the sixth day and ceased on the seventh)","Elohim blessed the seventh day and sanctified it, for on it He abstained from all His work, which Elohim had created to do.","And God blessed the seventh day, and sanctified it: because in it He rested from all his work which God had created and performed.",phrase_translation,translation_context,pending_yossi_extraction_accuracy_pass,long_parenthetical;awkward_source_wording;phrase_boundary_check;source_only_recommended,Confirm the parenthetical belongs to this Hebrew phrase. Confirm awkward English is source-derived and should remain unchanged. Confirm Hebrew-English phrase alignment against the trusted source. Keep source-only unless a separate future question/protected-preview gate approves use.,verified,,
bereishis_2_1_to_2_3_source_to_skill_map_row_003,Bereishis 2:2,וַיְכַל אֱלֹהִים בַּיּוֹם הַשְּׁבִיעִי מְלַאכְתּוֹ אֲשֶׁר עָשָׂה,and Hashem finished in the seventh day His constructive work that He made,"Elohim completed by the seventh day His work which He had made, and He abstained on the seventh day from all His work which He had made.",And by the seventh day God ended His work which He had done; and He rested on the seventh day from all His work which He had done.,phrase_translation,translation_context,pending_yossi_extraction_accuracy_pass,long_hebrew_boundary;phrase_boundary_check;source_only_recommended,Confirm the Hebrew phrase boundary and segment join are reasonable. Confirm Hebrew-English phrase alignment against the trusted source. Keep source-only unless a separate future question/protected-preview gate approves use.,verified,,
bereishis_2_1_to_2_3_source_to_skill_map_row_006,Bereishis 2:3,וַיְבָרֶךְ אֱלֹהִים אֶת יוֹם הַשְּׁבִיעִי וַיְקַדֵּשׁ אֹתוֹ,and Hashem blessed the seventh day and He caused it to be holy,"Elohim blessed the seventh day and sanctified it, for on it He abstained from all His work, which Elohim had created to do.","And God blessed the seventh day, and sanctified it: because in it He rested from all his work which God had created and performed.",phrase_translation,translation_context,pending_yossi_extraction_accuracy_pass,long_hebrew_boundary;phrase_boundary_check;source_only_recommended,Confirm the Hebrew phrase boundary and segment join are reasonable. Confirm Hebrew-English phrase alignment against the trusted source. Keep source-only unless a separate future question/protected-preview gate approves use.,verified,,
bereishis_2_1_to_2_3_source_to_skill_map_row_001,Bereishis 2:1,וַיְכֻלּוּ הַשָּׁמַיִם וְהָאָרֶץ,and the sky and land were completed,"The heavens and the earth were completed, and [so were] all their conglomerations.","Thus the heavens and the earth were finished, and all their host.",phrase_translation,translation_context,pending_yossi_extraction_accuracy_pass,phrase_boundary_check;source_only_recommended,Confirm Hebrew-English phrase alignment against the trusted source. Keep source-only unless a separate future question/protected-preview gate approves use.,verified,,
bereishis_2_1_to_2_3_source_to_skill_map_row_004,Bereishis 2:2,וַיִּשְׁבֹּת בַּיּוֹם הַשְּׁבִיעִי,and He ceased in the seventh day,"Elohim completed by the seventh day His work which He had made, and He abstained on the seventh day from all His work which He had made.",And by the seventh day God ended His work which He had done; and He rested on the seventh day from all His work which He had done.,phrase_translation,translation_context,pending_yossi_extraction_accuracy_pass,phrase_boundary_check;source_only_recommended,Confirm Hebrew-English phrase alignment against the trusted source. Keep source-only unless a separate future question/protected-preview gate approves use.,verified,,
bereishis_2_1_to_2_3_source_to_skill_map_row_005,Bereishis 2:2,מִכָּל מְלַאכְתּוֹ אֲשֶׁר עָשָׂה,from all His constructive work that He made,"Elohim completed by the seventh day His work which He had made, and He abstained on the seventh day from all His work which He had made.",And by the seventh day God ended His work which He had done; and He rested on the seventh day from all His work which He had done.,phrase_translation,translation_context,pending_yossi_extraction_accuracy_pass,phrase_boundary_check;source_only_recommended,Confirm Hebrew-English phrase alignment against the trusted source. Keep source-only unless a separate future question/protected-preview gate approves use.,verified,,
bereishis_2_1_to_2_3_source_to_skill_map_row_007,Bereishis 2:3,כִּי בוֹ שָׁבַת,because in it He ceased,"Elohim blessed the seventh day and sanctified it, for on it He abstained from all His work, which Elohim had created to do.","And God blessed the seventh day, and sanctified it: because in it He rested from all his work which God had created and performed.",phrase_translation,translation_context,pending_yossi_extraction_accuracy_pass,phrase_boundary_check;source_only_recommended,Confirm Hebrew-English phrase alignment against the trusted source. Keep source-only unless a separate future question/protected-preview gate approves use.,verified,,
bereishis_2_1_to_2_3_source_to_skill_map_row_008,Bereishis 2:3,מִכָּל מְלַאכְתּוֹ,from all His constructive work,"Elohim blessed the seventh day and sanctified it, for on it He abstained from all His work, which Elohim had created to do.","And God blessed the seventh day, and sanctified it: because in it He rested from all his work which God had created and performed.",phrase_translation,translation_context,pending_yossi_extraction_accuracy_pass,phrase_boundary_check;source_only_recommended,Confirm Hebrew-English phrase alignment against the trusted source. Keep source-only unless a separate future question/protected-preview gate approves use.,verified,,
